{
  "contractVersion": 1,
  "source": "meyton-ssmdb2",
  "sourceVersion": "6.0.2",
  "epoch": 1,
  "scheibenId": 1183406,
  "sequence": 30,
  "observedAt": "2026-10-06T17:33:06.020Z",
  "sessionTimeZone": "+00:00",
  "data": {
    "scheiben": {
      "columns": {
        "ScheibenID": "int(11)",
        "Starterliste": "varchar(50)",
        "StarterlisteID": "int(11)",
        "Startzeit": "datetime",
        "StartNr": "int(11)",
        "Nachname": "varchar(30)",
        "Vorname": "varchar(30)",
        "Geschlecht": "char(1)",
        "Land": "varchar(3)",
        "SportpassID": "int(11)",
        "StandNr": "int(11)",
        "StandNrText": "varchar(10)",
        "Disziplin": "varchar(50)",
        "DisziplinID": "int(11)",
        "Klasse": "varchar(50)",
        "KlasseID": "int(11)",
        "Verein": "varchar(50)",
        "VereinID": "int(11)",
        "Mannschaft": "varchar(50)",
        "MannschaftID": "int(11)",
        "Rangliste": "varchar(50)",
        "RanglisteID": "int(11)",
        "Gruppe": "varchar(50)",
        "GruppeID": "int(11)",
        "Status": "int(11)",
        "Trefferzahl": "int(11)",
        "TotalRing": "int(11)",
        "TotalRing01": "int(11)",
        "BesterTeiler01": "int(11)",
        "BesterTeiler001": "int(11)",
        "Zeitstempel": "datetime"
      },
      "rows": [
        {
          "ScheibenID": "1183406",
          "Starterliste": "Training",
          "StarterlisteID": "1",
          "Startzeit": "0000-00-00 00:00:00",
          "StartNr": "0",
          "Nachname": "Muster",
          "Vorname": "Max",
          "Geschlecht": "M",
          "Land": "GER",
          "SportpassID": "12345678",
          "StandNr": "4",
          "StandNrText": "4",
          "Disziplin": "LG 40 Schuss",
          "DisziplinID": "10",
          "Klasse": "Herren",
          "KlasseID": "1",
          "Verein": "SV Beispiel",
          "VereinID": "1",
          "Mannschaft": "",
          "MannschaftID": "0",
          "Rangliste": "",
          "RanglisteID": "0",
          "Gruppe": "",
          "GruppeID": "0",
          "Status": "1",
          "Trefferzahl": "0",
          "TotalRing": "0",
          "TotalRing01": "0",
          "BesterTeiler01": "0",
          "BesterTeiler001": "0",
          "Zeitstempel": "2026-10-06 19:32:05"
        }
      ]
    },
    "serien": {
      "columns": {
        "ScheibenID": "int(11)",
        "Stellung": "int(11)",
        "Serie": "int(11)",
        "Ring": "int(11)",
        "Ring01": "int(11)"
      },
      "rows": []
    },
    "treffer": {
      "columns": {
        "ScheibenID": "int(11)",
        "Stellung": "int(11)",
        "Treffer": "int(11)",
        "Serie": "int(11)",
        "x": "int(11)",
        "y": "int(11)",
        "Innenzehner": "tinyint(1)",
        "Wertung": "int(11)",
        "Text": "varchar(20)",
        "Ring": "int(11)",
        "Ring01": "int(11)",
        "Teiler01": "int(11)",
        "Teiler001": "int(11)",
        "Zeitstempel": "datetime",
        "Millisekunden": "int(11)"
      },
      "rows": [
        {
          "ScheibenID": "1183406",
          "Stellung": "0",
          "Treffer": "1",
          "Serie": "0",
          "x": "40",
          "y": "-20",
          "Innenzehner": "0",
          "Wertung": "1",
          "Text": null,
          "Ring": "10",
          "Ring01": "107",
          "Teiler01": "4",
          "Teiler001": "45",
          "Zeitstempel": "2026-10-06 19:30:05",
          "Millisekunden": "500"
        },
        {
          "ScheibenID": "1183406",
          "Stellung": "0",
          "Treffer": "2",
          "Serie": "0",
          "x": "-75",
          "y": "66",
          "Innenzehner": "0",
          "Wertung": "1",
          "Text": null,
          "Ring": "10",
          "Ring01": "105",
          "Teiler01": "10",
          "Teiler001": "100",
          "Zeitstempel": "2026-10-06 19:31:05",
          "Millisekunden": "501"
        },
        {
          "ScheibenID": "1183406",
          "Stellung": "0",
          "Treffer": "3",
          "Serie": "0",
          "x": "12",
          "y": "9",
          "Innenzehner": "1",
          "Wertung": "1",
          "Text": null,
          "Ring": "10",
          "Ring01": "108",
          "Teiler01": "2",
          "Teiler001": "15",
          "Zeitstempel": "2026-10-06 19:32:05",
          "Millisekunden": "502"
        }
      ]
    }
  },
  "checksum": "sha256:58b81f26598211212f1b806afa9cc218ad6f4d6c9a0b9ce0fde57ff208b0922a"
}
